{
  "user_id": "student_001",
  "last_sync_timestamp": "2026-03-01T17:56:16.183672",
  "streak": {
    "current": 0,
    "longest": 0,
    "last_activity_date": "2026-03-01"
  },
  "quiz_stats": {
    "total_attempted": 0,
    "total_correct": 0,
    "average_score": 0.0,
    "by_topic": {}
  },
  "flashcard_stats": {
    "total_reviewed": 0,
    "mastered": 0,
    "due_for_review": 0
  },
  "chat_history": [],
  "preferences": {
    "difficulty_level": "Beginner",
    "theme": "light",
    "language": "English"
  },
  "hardware_info": {
    "ram_gb": 15.63,
    "cpu_model": "Intel64 Family 6 Model 186 Stepping 2, GenuineIntel",
    "disk_space_gb": 85.75
  }
}