{
  "user_id": "",
  "last_sync_timestamp": "2026-03-08T14:53:20.255149+00:00",
  "streak": {
    "current": 1,
    "longest": 1,
    "last_active_date": "2026-03-08",
    "milestone_next": 7
  },
  "quiz_stats": {
    "total_attempted": 0,
    "total_correct": 0,
    "average_score": 0.0,
    "last_quiz_date": null,
    "by_topic": {},
    "total_score_sum": 0,
    "total_max_sum": 0,
    "average_percent": 0,
    "last_score": null
  },
  "flashcard_stats": {
    "total_reviewed": 2,
    "mastered": 0,
    "due_for_review": 10,
    "cards": {
      "1": {
        "ease": "hard",
        "next_review": "2026-03-09T12:31:58.541Z",
        "review_count": 1,
        "mastered": false
      }
    }
  },
  "chat_history": [
    {
      "role": "assistant",
      "content": "Hi! I'm your AI tutor powered by Llama 3.2 with RAG grounding from your textbooks. Ask me anything — I work fully offline. 🎓",
      "timestamp": "2026-03-08T15:26:01.957Z"
    },
    {
      "role": "user",
      "content": "all formulas for class 11th ncert maths",
      "timestamp": "2026-03-08T15:26:30.788Z",
      "is_clarification": false
    },
    {
      "role": "assistant",
      "content": "Class 11th NCERT Maths Formulas:\n\n**Algebra**\n\n* Mean: $\\frac{\\text{Sum of values}}{\\text{Number of values}}$\n* Median: Middle value in a sorted list of values\n* Mode: Value that appears most frequently\n* Range: Difference between maximum and minimum values\n* Quadratic Formula: $$x = \\frac{-b \\pm \\sqrt{b^2 - 4ac}}{2a}$$\n\n**Geometry**\n\n* Circumference of a Circle: $2\\pi r$\n* Area of a Circle: $\\pi r^2$\n* Perimeter of a Triangle: Sum of lengths of all sides\n* Area of a Triangle: $\\frac{1}{2} \\times \\text{base} \\times \\text{height}$\n* Pythagorean Theorem: $$a^2 + b^2 = c^2$$\n\n**Trigonometry**\n\n* Sine, Cosine, and Tangent Ratios: $$\\sin \\theta = \\frac{\\text{opposite}}{\\text{hypotenuse}}, \\cos \\theta = \\frac{\\text{adjacent}}{\\text{hypotenuse}}, \\tan \\theta = \\frac{\\text{opposite}}{\\text{adjacent}}$$\n* Pythagorean Identity: $$\\sin^2 \\theta + \\cos^2 \\theta = 1$$\n* Sum and Difference Formulas: $$\\sin (A \\pm B) = \\sin A \\cos B \\pm \\cos A \\sin B$$\n\n**Statistics and Probability**\n\n* Mean and Median: Measures of central tendency\n* Mode and Median: Measures of central tendency\n* Standard Deviation: Measure of dispersion\n* Probability Formula: $$P(\\text{event}) = \\frac{\\text{Number of favorable outcomes}}{\\text{Total number of outcomes}}$$\n\nThese are some of the key formulas and concepts in Class 11th NCERT Maths. If you have any specific questions or need clarification on any of these topics, feel free to ask!",
      "timestamp": "2026-03-08T15:27:12.414Z",
      "is_clarification": false
    },
    {
      "role": "user",
      "content": "what is bias tradeoff",
      "timestamp": "2026-03-08T15:29:54.830Z",
      "is_clarification": false
    },
    {
      "role": "assistant",
      "content": "In Maths, particularly in Statistics and Probability, there isn't a direct concept called \"bias tradeoff.\" However, I think you might be referring to the tradeoff between bias and variance in prediction models.\n\nBias-Variance Tradeoff:\n\nIn simple terms, this tradeoff refers to the balance between two types of errors in a prediction model:\n\n1. **Bias**: This is the difference between the predicted value and the actual value, which is often due to the model's tendency to overfit or underfit the data. A high bias means the model is too simple and doesn't capture the underlying patterns well.\n2. **Variance**: This is the difference between the predicted value and the predicted value of a different model, which is often due to the model's tendency to overfit or underfit the data. A high variance means the model is too complex and overestimates the noise in the data.\n\nThe ideal tradeoff is to have a model with low bias (predicts the correct average value) and low variance (minimizes the fluctuations around the average value). However, as one tries to reduce bias, variance often increases, and vice versa.\n\nThink of it like trying to draw a line that best fits a set of points. A good line should have low bias (be close to the average point) and low variance (not wobble too much). However, if you try to make the line too perfect (low bias), it might also overfit the noise in the data (high variance).\n\nThis tradeoff is an important consideration in model selection and design in Statistics and Machine Learning.\n\nRecap: The bias-variance tradeoff is a fundamental concept in Statistics and Machine Learning, where a balance must be struck between bias (overfitting) and variance (overfitting noise).",
      "timestamp": "2026-03-08T15:30:28.165Z",
      "is_clarification": false
    }
  ],
  "preferences": {
    "difficulty_level": "Beginner",
    "theme": "light",
    "language": "English",
    "sync_enabled": true
  },
  "hardware_info": {}
}